{
  "schema_version": "1.2",
  "generated_at": "2026-09-16T12:00:00Z",
  "sources": [
    {"path": "examples/requirements.md", "role": "FUNCTIONAL_AUTHORITY"},
    {"path": "examples/selected-source/order_service.py", "role": "IMPLEMENTATION_EVIDENCE"}
  ],
  "requirements": [
    {
      "id": "REQ-001",
      "statement": "A signed-in customer with ORDER_EDIT can create an order that receives a visible reference and starts in DRAFT state.",
      "status": "TESTABLE",
      "source_refs": [{"source": "examples/requirements.md", "reference": "ORD-001"}]
    },
    {
      "id": "REQ-002",
      "statement": "A DRAFT order line accepts integer quantities from 1 through 10 and rejects values outside that range without changing the existing quantity.",
      "status": "TESTABLE",
      "source_refs": [{"source": "examples/requirements.md", "reference": "ORD-002"}]
    },
    {
      "id": "REQ-003",
      "statement": "Submitting a DRAFT order changes it to SUBMITTED, after which edits are rejected without changing order data.",
      "status": "TESTABLE",
      "source_refs": [{"source": "examples/requirements.md", "reference": "ORD-003"}]
    },
    {
      "id": "REQ-004",
      "statement": "A signed-in customer without ORDER_EDIT cannot create or edit orders, and denied attempts do not change order data.",
      "status": "TESTABLE",
      "source_refs": [{"source": "examples/requirements.md", "reference": "ORD-004"}]
    },
    {
      "id": "REQ-005",
      "statement": "A customer can cancel an order before invoicing.",
      "status": "NEEDS_CLARIFICATION",
      "source_refs": [{"source": "examples/requirements.md", "reference": "ORD-005"}]
    },
    {
      "id": "REQ-006",
      "statement": "When billing is unavailable during submission, submission does not complete and retry is available.",
      "status": "NEEDS_CLARIFICATION",
      "source_refs": [{"source": "examples/requirements.md", "reference": "ORD-006"}]
    },
    {
      "id": "REQ-007",
      "statement": "Orders should be processed quickly.",
      "status": "NEEDS_CLARIFICATION",
      "source_refs": [{"source": "examples/requirements.md", "reference": "ORD-007"}]
    },
    {
      "id": "REQ-008",
      "statement": "Finalizing a SUBMITTED order changes it to FINALIZED and shows a visible confirmation.",
      "status": "TESTABLE",
      "source_refs": [{"source": "examples/requirements.md", "reference": "ORD-008"}]
    }
  ],
  "findings": [
    {
      "id": "FND-001",
      "type": "IMPLEMENTATION_DIVERGENCE",
      "statement": "The selected implementation sets PROCESSING after submission, while the authoritative requirement expects SUBMITTED.",
      "requirement_refs": ["REQ-003"],
      "source_refs": [
        {"source": "examples/requirements.md", "reference": "ORD-003"},
        {"source": "examples/selected-source/order_service.py", "reference": "submit_order"}
      ]
    },
    {
      "id": "FND-002",
      "type": "COVERAGE_GAP",
      "statement": "The selected implementation finalizes state but provides no evidence of the visible confirmation required by the functional authority.",
      "requirement_refs": ["REQ-008"],
      "source_refs": [
        {"source": "examples/requirements.md", "reference": "ORD-008"},
        {"source": "examples/selected-source/order_service.py", "reference": "finalize_order"}
      ]
    }
  ],
  "coverage_points": [
    {"id": "CP-001", "requirement_ref": "REQ-001", "statement": "An authorized signed-in customer can create an order.", "source_refs": [{"source": "examples/requirements.md", "reference": "ORD-001"}], "disposition": "TEST_CASE", "target_refs": ["TC-001"]},
    {"id": "CP-002", "requirement_ref": "REQ-001", "statement": "Successful order creation provides a visible order reference.", "source_refs": [{"source": "examples/requirements.md", "reference": "ORD-001"}], "disposition": "TEST_CASE", "target_refs": ["TC-001"]},
    {"id": "CP-003", "requirement_ref": "REQ-001", "statement": "A created order is shown in DRAFT state.", "source_refs": [{"source": "examples/requirements.md", "reference": "ORD-001"}], "disposition": "TEST_CASE", "target_refs": ["TC-001"]},
    {"id": "CP-004", "requirement_ref": "REQ-002", "statement": "The minimum quantity 1 is accepted.", "source_refs": [{"source": "examples/requirements.md", "reference": "ORD-002"}], "disposition": "TEST_CASE", "target_refs": ["TC-002"]},
    {"id": "CP-005", "requirement_ref": "REQ-002", "statement": "The maximum quantity 10 is accepted.", "source_refs": [{"source": "examples/requirements.md", "reference": "ORD-002"}], "disposition": "TEST_CASE", "target_refs": ["TC-003"]},
    {"id": "CP-006", "requirement_ref": "REQ-002", "statement": "A quantity below the minimum is rejected.", "source_refs": [{"source": "examples/requirements.md", "reference": "ORD-002"}], "disposition": "TEST_CASE", "target_refs": ["TC-004"]},
    {"id": "CP-007", "requirement_ref": "REQ-002", "statement": "After a below-minimum rejection, the existing quantity remains unchanged.", "source_refs": [{"source": "examples/requirements.md", "reference": "ORD-002"}], "disposition": "TEST_CASE", "target_refs": ["TC-004"]},
    {"id": "CP-008", "requirement_ref": "REQ-002", "statement": "A quantity above the maximum is rejected.", "source_refs": [{"source": "examples/requirements.md", "reference": "ORD-002"}], "disposition": "TEST_CASE", "target_refs": ["TC-005"]},
    {"id": "CP-009", "requirement_ref": "REQ-002", "statement": "After an above-maximum rejection, the existing quantity remains unchanged.", "source_refs": [{"source": "examples/requirements.md", "reference": "ORD-002"}], "disposition": "TEST_CASE", "target_refs": ["TC-005"]},
    {"id": "CP-010", "requirement_ref": "REQ-003", "statement": "A DRAFT order can be submitted.", "source_refs": [{"source": "examples/requirements.md", "reference": "ORD-003"}], "disposition": "TEST_CASE", "target_refs": ["TC-006"]},
    {"id": "CP-011", "requirement_ref": "REQ-003", "statement": "Successful submission changes the order state to SUBMITTED.", "source_refs": [{"source": "examples/requirements.md", "reference": "ORD-003"}, {"source": "examples/selected-source/order_service.py", "reference": "submit_order diverges by setting PROCESSING"}], "disposition": "TEST_CASE", "target_refs": ["TC-006"]},
    {"id": "CP-012", "requirement_ref": "REQ-003", "statement": "An edit to a SUBMITTED order is rejected.", "source_refs": [{"source": "examples/requirements.md", "reference": "ORD-003"}], "disposition": "TEST_CASE", "target_refs": ["TC-007"]},
    {"id": "CP-013", "requirement_ref": "REQ-003", "statement": "A rejected edit leaves submitted order data unchanged.", "source_refs": [{"source": "examples/requirements.md", "reference": "ORD-003"}], "disposition": "TEST_CASE", "target_refs": ["TC-007"]},
    {"id": "CP-014", "requirement_ref": "REQ-004", "statement": "Order creation without ORDER_EDIT is denied.", "source_refs": [{"source": "examples/requirements.md", "reference": "ORD-004"}], "disposition": "TEST_CASE", "target_refs": ["TC-008"]},
    {"id": "CP-015", "requirement_ref": "REQ-004", "statement": "A denied create attempt creates no order data.", "source_refs": [{"source": "examples/requirements.md", "reference": "ORD-004"}], "disposition": "TEST_CASE", "target_refs": ["TC-008"]},
    {"id": "CP-016", "requirement_ref": "REQ-004", "statement": "Order editing without ORDER_EDIT is denied.", "source_refs": [{"source": "examples/requirements.md", "reference": "ORD-004"}], "disposition": "TEST_CASE", "target_refs": ["TC-009"]},
    {"id": "CP-017", "requirement_ref": "REQ-004", "statement": "A denied edit attempt leaves order data unchanged.", "source_refs": [{"source": "examples/requirements.md", "reference": "ORD-004"}], "disposition": "TEST_CASE", "target_refs": ["TC-009"]},
    {"id": "CP-018", "requirement_ref": "REQ-005", "statement": "A customer can cancel an order before invoicing, but the observable success result is undefined.", "source_refs": [{"source": "examples/requirements.md", "reference": "ORD-005"}], "disposition": "QUESTION", "target_refs": ["Q-001"]},
    {"id": "CP-019", "requirement_ref": "REQ-006", "statement": "Submission does not complete when billing is unavailable.", "source_refs": [{"source": "examples/requirements.md", "reference": "ORD-006"}], "disposition": "TEST_CASE", "target_refs": ["TC-010"]},
    {"id": "CP-020", "requirement_ref": "REQ-006", "statement": "A retry action is available after billing unavailability.", "source_refs": [{"source": "examples/requirements.md", "reference": "ORD-006"}], "disposition": "TEST_CASE", "target_refs": ["TC-010"]},
    {"id": "CP-021", "requirement_ref": "REQ-006", "statement": "The order state and retained data after billing failure are undefined.", "source_refs": [{"source": "examples/requirements.md", "reference": "ORD-006"}], "disposition": "QUESTION", "target_refs": ["Q-002"]},
    {"id": "CP-022", "requirement_ref": "REQ-007", "statement": "The required processing speed has no measurable target.", "source_refs": [{"source": "examples/requirements.md", "reference": "ORD-007"}], "disposition": "QUESTION", "target_refs": ["Q-003"]},
    {"id": "CP-023", "requirement_ref": "REQ-008", "statement": "Finalizing a SUBMITTED order changes its state to FINALIZED.", "source_refs": [{"source": "examples/requirements.md", "reference": "ORD-008"}, {"source": "examples/selected-source/order_service.py", "reference": "finalize_order sets FINALIZED"}], "disposition": "TEST_CASE", "target_refs": ["TC-011"]},
    {"id": "CP-024", "requirement_ref": "REQ-008", "statement": "Successful finalization shows a visible confirmation.", "source_refs": [{"source": "examples/requirements.md", "reference": "ORD-008"}, {"source": "examples/selected-source/order_service.py", "reference": "finalize_order has no confirmation evidence"}], "disposition": "TEST_CASE", "target_refs": ["TC-011"]}
  ],
  "scenarios": [